{
  "task_name": "demo-todo-app",
  "timestamp": "2026-02-25T12:01:00+08:00",
  "workdir": "/tmp/demo-todo-app",
  "status": "done",
  "summary": "Applied minimal patch to fix failing test",
  "output_tail": "...",
  "artifacts": {
    "run_dir": "/tmp/demo-todo-app/.openclaw-runs/demo-run-2",
    "stdout_path": "/tmp/demo-todo-app/.openclaw-runs/demo-run-2/task-output.txt",
    "codex_events_jsonl_path": "/tmp/demo-todo-app/.openclaw-runs/demo-run-2/codex-events.jsonl",
    "codex_last_message_path": "/tmp/demo-todo-app/.openclaw-runs/demo-run-2/codex-last-message.json",
    "codex_output_schema_path": "/tmp/demo-todo-app/.openclaw-runs/demo-run-2/codex-output.schema.json"
  }
}
