{
  "task_name": "real-smoke-readme",
  "timestamp": "2026-02-25T12:56:00+08:00",
  "workdir": "/tmp/openclawa-real-smoke",
  "status": "done",
  "summary": "Codex created README.md (real run)",
  "output_tail": "{\"type\":\"thread.started\",\"thread_id\":\"019c9328-a9f7-7821-91df-9a70d0fd512a\"}\n{\"type\":\"turn.started\"}\n{\"type\":\"item.completed\",\"item\":{\"id\":\"item_0\",\"type\":\"reasoning\",\"text\":\"**Initiating directory inspection**\"}}\n{\"type\":\"item.completed\",\"item\":{\"id\":\"item_1\",\"type\":\"agent_message\",\"text\":\"{\\\"summary\\\":\\\"I’ll inspect the directory contents first so the one-line README description is accurate, then I’ll create/update `README.md`.\\\",\\\"changes\\\":[]}\"}}\n{\"type\":\"item.completed\",\"item\":{\"id\":\"item_2\",\"type\":\"reasoning\",\"text\":\"**Choosing command execution approach**\"}}\n{\"type\":\"item.started\",\"item\":{\"id\":\"item_3\",\"type\":\"command_execution\",\"command\":\"/bin/zsh -lc 'rg --files'\",\"aggregated_output\":\"\",\"exit_code\":null,\"status\":\"in_progress\"}}\n{\"type\":\"item.completed\",\"item\":{\"id\":\"item_3\",\"type\":\"command_execution\",\"command\":\"/bin/zsh -lc 'rg --files'\",\"aggregated_output\":\"\",\"exit_code\":1,\"status\":\"failed\"}}\n{\"type\":\"item.completed\",\"item\":{\"id\":\"item_4\",\"type\":\"reasoning\",\"text\":\"**Confirming empty directory**\"}}\n{\"type\":\"item.completed\",\"item\":{\"id\":\"item_5\",\"type\":\"agent_message\",\"text\":\"{\\\"summary\\\":\\\"No tracked files showed up yet, so I’m checking the directory listing directly before creating the README.\\\",\\\"changes\\\":[]}\"}}\n{\"type\":\"item.started\",\"item\":{\"id\":\"item_6\",\"type\":\"command_execution\",\"command\":\"/bin/zsh -lc 'ls -la'\",\"aggregated_output\":\"\",\"exit_code\":null,\"status\":\"in_progress\"}}\n{\"type\":\"item.completed\",\"item\":{\"id\":\"item_6\",\"type\":\"command_execution\",\"command\":\"/bin/zsh -lc 'ls -la'\",\"aggregated_output\":\"total 0\\ndrwxr-xr-x   4 limou  wheel   128 Feb 25 12:57 .\\ndrwxrwxrwt  32 root   wheel  1024 Feb 25 12:57 ..\\ndrwxr-xr-x   9 limou  wheel   288 Feb 25 12:57 .git\\ndrwxr-xr-x   3 limou  wheel    96 Feb 25 12:57 .openclaw-runs\\n\",\"exit_code\":0,\"status\":\"completed\"}}\n{\"type\":\"item.completed\",\"item\":{\"id\":\"item_7\",\"type\":\"reasoning\",\"text\":\"**Preparing README creation**\"}}\n{\"type\":\"item.completed\",\"item\":{\"id\":\"item_8\",\"type\":\"agent_message\",\"text\":\"{\\\"summary\\\":\\\"I found this repo is essentially a minimal smoke-test workspace with run artifacts, and I’m now adding a one-line `README.md` description.\\\",\\\"changes\\\":[]}\"}}\n{\"type\":\"item.completed\",\"item\":{\"id\":\"item_9\",\"type\":\"file_change\",\"changes\":[{\"path\":\"/tmp/openclawa-real-smoke/README.md\",\"kind\":\"add\"}],\"status\":\"completed\"}}\n{\"type\":\"item.completed\",\"item\":{\"id\":\"item_10\",\"type\":\"reasoning\",\"text\":\"{\\\"summary\\\":\\\"Confirming output format requirements and planning quick file content verification\\\",\\\"changes\\\":[]}\"}}\n{\"type\":\"item.started\",\"item\":{\"id\":\"item_11\",\"type\":\"command_execution\",\"command\":\"/bin/zsh -lc 'cat README.md'\",\"aggregated_output\":\"\",\"exit_code\":null,\"status\":\"in_progress\"}}\n{\"type\":\"item.completed\",\"item\":{\"id\":\"item_11\",\"type\":\"command_execution\",\"command\":\"/bin/zsh -lc 'cat README.md'\",\"aggregated_output\":\"This directory contains a minimal OpenClawa real-smoke test repository and its run metadata.\\n\",\"exit_code\":0,\"status\":\"completed\"}}\n{\"type\":\"item.completed\",\"item\":{\"id\":\"item_12\",\"type\":\"reasoning\",\"text\":\"```json\\n{\\\"summary\\\":\\\"Created README.md with a one-line description of the directory.\\\",\\\"changes\\\":[\\\"Added /tmp/openclawa-real-smoke/README.md containing: \\\\\\\"This directory contains a minimal OpenClawa real-smoke test repository and its run metadata.\\\\\\\"\\\"]}\\n```\"}}\n{\"type\":\"item.completed\",\"item\":{\"id\":\"item_13\",\"type\":\"agent_message\",\"text\":\"{\\\"summary\\\":\\\"Created README.md with a one-line description of this directory.\\\",\\\"changes\\\":[\\\"Added /tmp/openclawa-real-smoke/README.md with: \\\\\\\"This directory contains a minimal OpenClawa real-smoke test repository and its run metadata.\\\\\\\"\\\"]}\"}}\n{\"type\":\"turn.completed\",\"usage\":{\"input_tokens\":46758,\"cached_input_tokens\":32000,\"output_tokens\":889}}\n",
  "artifacts": {
    "run_dir": "/tmp/openclawa-real-smoke/.openclaw-runs/real-smoke-20260225-1256",
    "stdout_path": "/tmp/openclawa-real-smoke/.openclaw-runs/real-smoke-20260225-1256/task-output.txt",
    "codex_events_jsonl_path": "/tmp/openclawa-real-smoke/.openclaw-runs/real-smoke-20260225-1256/codex-events.jsonl",
    "codex_last_message_path": "/tmp/openclawa-real-smoke/.openclaw-runs/real-smoke-20260225-1256/codex-last-message.json",
    "codex_output_schema_path": "/tmp/openclawa-real-smoke/.openclaw-runs/real-smoke-20260225-1256/codex-output.schema.json"
  }
}
